name,full_name,url,description,last_updated,flavors,curse_id,wago_id,wowi_id
premade-applicants-filter,0xbs/premade-applicants-filter,https://github.com/0xbs/premade-applicants-filter,Allows filtering of premade applicants using advanced filter expressions.,2021-12-26T09:40:18+00:00,mainline,,,
premade-groups-filter,0xbs/premade-groups-filter,https://github.com/0xbs/premade-groups-filter,A World of Warcraft addon for powerful filtering of premade group listings,2021-12-26T09:40:15+00:00,mainline,,,
premade-regions,0xbs/premade-regions,https://github.com/0xbs/premade-regions,Provides region information in the premade groups and applicants listings as well as to other addons.,2021-07-09T18:02:33+00:00,mainline,,,
HandyNotes_MoleMachine,AcidWeb/HandyNotes_MoleMachine,https://github.com/AcidWeb/HandyNotes_MoleMachine,Display locations of Dark Iron Dwarf mole machines.,2021-11-03T06:23:36+00:00,mainline,300570,baNDD4No,24766
PMWishList,AcidWeb/PMWishList,https://github.com/AcidWeb/PMWishList,,2021-11-04T09:11:32+00:00,mainline,356943,,
RECrystallize,AcidWeb/RECrystallize,https://github.com/AcidWeb/RECrystallize,Provide Auction House scanner and add item prices to tooltips.,2021-11-03T06:36:44+00:00,mainline,359808,9rN4JdKD,25496
REFlex,AcidWeb/REFlex,https://github.com/AcidWeb/REFlex,Collect statistics of played arena matches and battlegrounds.,2021-11-04T09:14:22+00:00,mainline,28545,vEGPQRN1,19190
REHack,AcidWeb/REHack,https://github.com/AcidWeb/REHack,Notebook/coding framework.,2021-11-03T06:34:11+00:00,mainline,299052,qv63Wn6b,24734
REKeys,AcidWeb/REKeys,https://github.com/AcidWeb/REKeys,Collect information about keystones owned by your friends.,2021-11-04T09:12:47+00:00,mainline,282397,XrNke8Ka,24510
REPorter,AcidWeb/REPorter,https://github.com/AcidWeb/REPorter,Provide proper battleground map.,2021-11-03T06:38:01+00:00,mainline,39399,Xb6X0o6p,21089
RETabBinder,AcidWeb/RETabBinder,https://github.com/AcidWeb/RETabBinder,Handle automatic change of targeting keybind,2021-11-03T06:32:26+00:00,mainline,39100,Rn6Ve8Nd,19089
AdiButtonAuras,AdiAddons/AdiButtonAuras,https://github.com/AdiAddons/AdiButtonAuras,WoW addon - Display auras on action buttons.,2021-09-12T09:46:09+00:00,mainline,68441,,
AltReps,Alastair-Scott/AltReps,https://github.com/Alastair-Scott/AltReps,AltReps is an addon that allows you to track reputations across your characters,2021-12-03T00:26:27+00:00,mainline,408394,,25680
ArenaLeaveConfirmer,AlexFolland/ArenaLeaveConfirmer,https://github.com/AlexFolland/ArenaLeaveConfirmer,,2021-07-04T22:12:06+00:00,"bcc,classic,mainline",49965,,
AutoGear,AlexFolland/AutoGear,https://github.com/AlexFolland/AutoGear,WoW convenience addon that automatically handles gear looting and equipping,2021-08-31T23:25:55+00:00,"bcc,classic,mainline",39179,,
BattlegroundSpiritReleaser,AlexFolland/BattlegroundSpiritReleaser,https://github.com/AlexFolland/BattlegroundSpiritReleaser,,2021-07-04T21:55:31+00:00,"bcc,classic,mainline",95070,,
CooldownReadyFlashDisabler,AlexFolland/CooldownReadyFlashDisabler,https://github.com/AlexFolland/CooldownReadyFlashDisabler,,2021-07-04T22:17:15+00:00,"bcc,classic,mainline",94999,,
DeleteConfirmer,AlexFolland/DeleteConfirmer,https://github.com/AlexFolland/DeleteConfirmer,Dangerous WoW addon that instantly confirms any item deletion,2021-07-05T05:06:56+00:00,"bcc,classic,mainline",377586,,
DeleteGoodItemConfirmHelper,AlexFolland/DeleteGoodItemConfirmHelper,https://github.com/AlexFolland/DeleteGoodItemConfirmHelper,,2021-07-04T21:48:28+00:00,"bcc,classic,mainline",95016,,
DirectGameMenu,AlexFolland/DirectGameMenu,https://github.com/AlexFolland/DirectGameMenu,,2021-07-05T04:49:09+00:00,"bcc,classic,mainline",101885,,
GarbageProtector,AlexFolland/GarbageProtector,https://github.com/AlexFolland/GarbageProtector,,2021-07-04T22:03:31+00:00,"bcc,classic,mainline",102242,,
PrintTracer,AlexFolland/PrintTracer,https://github.com/AlexFolland/PrintTracer,World Of Warcraft addon for tracing the source of print calls,2021-07-05T05:19:11+00:00,"bcc,classic,mainline",272786,,
CovenantFeatureRewards,ArekosAddons/CovenantFeatureRewards,https://github.com/ArekosAddons/CovenantFeatureRewards,Shows which rewards you can get from your covenant feature,2021-10-01T18:23:21+00:00,mainline,,,
LunarlightPodHelper,ArekosAddons/LunarlightPodHelper,https://github.com/ArekosAddons/LunarlightPodHelper,Helps finding unlit Lunarlight Pods,2021-10-01T18:32:47+00:00,mainline,,,
Auctionator,Auctionator/Auctionator,https://github.com/Auctionator/Auctionator,The Auctionator addon for World of Warcraft.,2021-11-11T18:27:38+00:00,"bcc,classic,mainline",,,
Collectionator,Auctionator/Collectionator,https://github.com/Auctionator/Collectionator,"World of Warcraft addon for the Auction House that adds a new Collecting tab to browse uncollected transmogs, pets, toys, mounts and recipes on all your alts.",2021-11-03T06:28:19+00:00,mainline,,,
Journalator,Auctionator/Journalator,https://github.com/Auctionator/Journalator,World of Warcraft addon. Keep track of your gold making on the AH and with vendors,2021-11-03T06:27:40+00:00,mainline,,,
AddOnSkins,Azilroka/AddOnSkins,https://github.com/Azilroka/AddOnSkins,,2021-10-17T04:07:00+00:00,"bcc,classic,mainline",54541,RXKqy5Ky,
ElvUI_TinkerToolbox,Azilroka/ElvUI_TinkerToolbox,https://github.com/Azilroka/ElvUI_TinkerToolbox,,2021-12-21T04:12:44+00:00,"bcc,classic,mainline",473233,Xb6X8o6p,
ThreatPlates,Backupiseasy/ThreatPlates,https://github.com/Backupiseasy/ThreatPlates,Nameplate addon for World of Warcraft,2021-12-19T10:13:21+00:00,"bcc,classic,mainline",21217,,15749
BattlePetQualityCheck,Beast-Masters-addons/BattlePetQualityCheck,https://github.com/Beast-Masters-addons/BattlePetQualityCheck,"Check if the quality of wild pets in a battle is better than pets of the same species in your journal. When the addon detects a pet with better quality, it displays a message in the default chat frame. The same happens when it detects a non-collected pet.",2021-08-20T20:33:52+00:00,mainline,313836,,25769
HuntersHelper,Beast-Masters-addons/HuntersHelper,https://github.com/Beast-Masters-addons/HuntersHelper,Show where to learn pet spells,2021-06-18T19:19:13+00:00,classic,,,25998
pet-battle-teams,Beast-Masters-addons/pet-battle-teams,https://github.com/Beast-Masters-addons/pet-battle-teams,,2021-08-21T17:08:08+00:00,mainline,,,
PantheonDKP,Bengejd/PantheonDKP,https://github.com/Bengejd/PantheonDKP,DKP Addon for the Blaumeux server guild: Pantheon!,2021-12-22T02:49:41+00:00,bcc,367232,,
BigWigs,BigWigsMods/BigWigs,https://github.com/BigWigsMods/BigWigs,"Modular, lightweight, non-intrusive approach to boss encounter warnings.",2021-12-12T11:19:05+00:00,mainline,2382,,5086
BigWigs_BattleForAzeroth,BigWigsMods/BigWigs_BattleForAzeroth,https://github.com/BigWigsMods/BigWigs_BattleForAzeroth,A collection of BigWigs modules from the Battle for Azeroth era.,2021-06-29T21:40:11+00:00,mainline,420598,,25791
BigWigs_BurningCrusade,BigWigsMods/BigWigs_BurningCrusade,https://github.com/BigWigsMods/BigWigs_BurningCrusade,A collection of BigWigs modules from the Burning Crusade era.,2021-09-16T23:47:50+00:00,mainline,50688,,22096
BigWigs_Cataclysm,BigWigsMods/BigWigs_Cataclysm,https://github.com/BigWigsMods/BigWigs_Cataclysm,A collection of BigWigs modules from the Cataclysm era.,2021-06-29T21:40:18+00:00,mainline,45694,,21755
BigWigs_Classic,BigWigsMods/BigWigs_Classic,https://github.com/BigWigsMods/BigWigs_Classic,A collection of BigWigs modules from the Classic era.,2021-06-29T21:40:18+00:00,mainline,50625,,22095
BigWigs_CommonAuras,BigWigsMods/BigWigs_CommonAuras,https://github.com/BigWigsMods/BigWigs_CommonAuras,Displays messages and bars for common raid cooldowns.,2021-06-30T05:34:51+00:00,mainline,13530,,23611
BigWigs_Countdown_HeroesOfTheStorm,BigWigsMods/BigWigs_Countdown_HeroesOfTheStorm,https://github.com/BigWigsMods/BigWigs_Countdown_HeroesOfTheStorm,Adds countdown voices from Heroes of the Storm to BigWigs.,2021-06-30T15:34:09+00:00,"bcc,classic,mainline",,,
BigWigs_Countdown_Overwatch,BigWigsMods/BigWigs_Countdown_Overwatch,https://github.com/BigWigsMods/BigWigs_Countdown_Overwatch,Adds countdown voices from the heroes in Overwatch to BigWigs.,2021-06-30T15:34:33+00:00,"bcc,classic,mainline",,,
BigWigs_Legion,BigWigsMods/BigWigs_Legion,https://github.com/BigWigsMods/BigWigs_Legion,A collection of BigWigs modules from the Legion era.,2021-06-29T21:40:27+00:00,mainline,300657,,24768
BigWigs_MistsOfPandaria,BigWigsMods/BigWigs_MistsOfPandaria,https://github.com/BigWigsMods/BigWigs_MistsOfPandaria,A collection of BigWigs modules from the Mists of Pandaria era.,2021-06-29T21:40:34+00:00,mainline,86782,,23493
BigWigs_Transcriptor,BigWigsMods/BigWigs_Transcriptor,https://github.com/BigWigsMods/BigWigs_Transcriptor,Simple addon that uses BigWigs for pull/win/wipe detection and starts or stops Transcriptor logging accordingly.,2021-06-30T05:18:52+00:00,"bcc,mainline",53389,,
BigWigs_Voice,BigWigsMods/BigWigs_Voice,https://github.com/BigWigsMods/BigWigs_Voice,A plugin for BigWigs that will play Text-To-Speech sounds for boss abilities.,2021-11-26T15:53:53+00:00,mainline,87513,,24218
BigWigs_WarlordsOfDraenor,BigWigsMods/BigWigs_WarlordsOfDraenor,https://github.com/BigWigsMods/BigWigs_WarlordsOfDraenor,A collection of BigWigs modules from the Warlords of Draenor era.,2021-06-29T21:40:39+00:00,mainline,101160,,24167
BigWigs_WrathOfTheLichKing,BigWigsMods/BigWigs_WrathOfTheLichKing,https://github.com/BigWigsMods/BigWigs_WrathOfTheLichKing,A collection of BigWigs modules from the Wrath of the Lich King era.,2021-06-29T21:40:50+00:00,mainline,50417,,22086
Capping,BigWigsMods/Capping,https://github.com/BigWigsMods/Capping,Battleground timers and other PvP features.,2021-12-01T23:29:12+00:00,mainline,20143,,11177
LittleWigs,BigWigsMods/LittleWigs,https://github.com/BigWigsMods/LittleWigs,Boss warnings for 5-man dungeons & scenarios.,2021-12-19T17:14:48+00:00,mainline,4383,,9577
Transcriptor,BigWigsMods/Transcriptor,https://github.com/BigWigsMods/Transcriptor,Logging utility for boss encounters.,2021-07-13T11:45:56+00:00,mainline,14837,,
oRA3,BigWigsMods/oRA3,https://github.com/BigWigsMods/oRA3,Raid and Party Assist.,2021-06-29T21:47:46+00:00,mainline,15655,,14635
BattleGroundEnemies,BullseiWoWAddons/BattleGroundEnemies,https://github.com/BullseiWoWAddons/BattleGroundEnemies,A enemy display for battlegrounds,2021-06-28T14:55:31+00:00,"bcc,mainline",274066,nQN5aoNB,
HealthNumbers,BullseiWoWAddons/HealthNumbers,https://github.com/BullseiWoWAddons/HealthNumbers,https://www.curseforge.com/wow/addons/healthnumbers,2021-06-08T21:25:18+00:00,bcc,491096,VBNBJaNx,
LibChangelog,BullseiWoWAddons/LibChangelog,https://github.com/BullseiWoWAddons/LibChangelog,,2021-06-28T14:51:31+00:00,"bcc,mainline",497698,,
Masque_Raeli,Caedilla/Masque_Raeli,https://github.com/Caedilla/Masque_Raeli,A plugin for the World of Warcraft addon Masque,2021-05-22T17:52:37+00:00,"bcc,classic,mainline",,,
RSA,Caedilla/RSA,https://github.com/Caedilla/RSA,Raeli's Spell Announcer. Easy spell announcements,2021-11-21T02:57:44+00:00,mainline,21464,,25709
RUF,Caedilla/RUF,https://github.com/Caedilla/RUF,Raeli's Unit Frames. A unitframe layout for oUF.,2021-05-18T20:43:11+00:00,mainline,283389,,
TargetNameplateIndicator,Choonster-WoW-AddOns/TargetNameplateIndicator,https://github.com/Choonster-WoW-AddOns/TargetNameplateIndicator,A WoW AddOn that puts a texture on your target's nameplate to make them stand out.,2021-10-03T07:03:10+00:00,mainline,42647,,21391
LFMPlus,ChrisKader/LFMPlus,https://github.com/ChrisKader/LFMPlus,"LFM+ (Looking for Mythic Plus) enhances the default LFG UI for Mythic+ activies to make looking for, or creating, a group for keys in World of Warcraft.",2021-12-09T20:39:13+00:00,mainline,532787,JZKb4yN1,
NPCScan,CruelDrool/NPCScan,https://github.com/CruelDrool/NPCScan,"NPCScan with rares in the Shadowlands zones, Darkshore, Nazjatar, Mechagon, N'Zoth assaults in Uldum/Vale of Eternal Blossoms.",2021-11-07T22:40:12+00:00,mainline,,,
AllTheThings,DFortun81/AllTheThings,https://github.com/DFortun81/AllTheThings,ALL THE THINGS - Addon for Tracking Collections & Account Completion in World of Warcraft,2021-12-20T18:19:44+00:00,mainline,267285,yQKyY5K7,
DBM-Archaeology,DeadlyBossMods/DBM-Archaeology,https://github.com/DeadlyBossMods/DBM-Archaeology,Brings the old gods right to your dig site to give archaeology a more epic feel.,2021-11-02T17:41:10+00:00,mainline,29493,,
DBM-BCVanilla,DeadlyBossMods/DBM-BCVanilla,https://github.com/DeadlyBossMods/DBM-BCVanilla,Deadly Boss Mods (DBM) - BC & Vanilla mods (Retail),2021-11-02T17:39:04+00:00,mainline,16442,7x61xpN1,11700
DBM-BfA,DeadlyBossMods/DBM-BfA,https://github.com/DeadlyBossMods/DBM-BfA,Deadly Boss Mods (DBM) - Battle for Azeroth mods,2021-11-02T17:38:48+00:00,mainline,420275,RXKqxj6y,25779
DBM-Cataclysm,DeadlyBossMods/DBM-Cataclysm,https://github.com/DeadlyBossMods/DBM-Cataclysm,Deadly Boss Mods (DBM) - Cataclysm mods,2021-11-02T17:41:29+00:00,mainline,43971,RBKpErGE,21469
DBM-Challenges,DeadlyBossMods/DBM-Challenges,https://github.com/DeadlyBossMods/DBM-Challenges,"This mod will add support for player challenges such as Proving Grounds, Broken Shore Mage Tower, BfA Horrific Visions, and Torghast scenarios to Deadly Boss Mods (DBM).",2021-12-26T02:38:04+00:00,mainline,61621,Rn6VLLGd,
DBM-Classic,DeadlyBossMods/DBM-Classic,https://github.com/DeadlyBossMods/DBM-Classic,"The ultimate encounter helper (for Classic) to give you fight info that's easy to process at a glance. DBM aims to focus on what's happening to you, and what YOU need to do about it.",2021-12-15T03:22:54+00:00,classic,3358,qv633o6b,8814
DBM-CountPack-HotS,DeadlyBossMods/DBM-CountPack-HotS,https://github.com/DeadlyBossMods/DBM-CountPack-HotS,A collection of Heroes of the Storm countdown sound options for use with Deadly Boss Mods.,2021-11-02T17:41:50+00:00,"bcc,classic,mainline",267646,XrNkewKa,
DBM-CountPack-Overwatch,DeadlyBossMods/DBM-CountPack-Overwatch,https://github.com/DeadlyBossMods/DBM-CountPack-Overwatch,A collection of Overwatch countdown sound options for use with Deadly Boss Mods.,2021-11-02T17:42:04+00:00,"bcc,classic,mainline",267605,kRNLxQNo,
DBM-Dungeons,DeadlyBossMods/DBM-Dungeons,https://github.com/DeadlyBossMods/DBM-Dungeons,"Adds support for 5 man Dungeons to Retail WoW, spanning Vanilla all the way to Legion, to Deadly Boss Mods.",2021-11-02T17:36:16+00:00,mainline,314994,xZKxZENk,24904
DBM-Legion,DeadlyBossMods/DBM-Legion,https://github.com/DeadlyBossMods/DBM-Legion,Deadly Boss Mods (DBM) - Legion mods,2021-11-02T17:40:35+00:00,mainline,301324,lQNlbaKe,24905
DBM-MoP,DeadlyBossMods/DBM-MoP,https://github.com/DeadlyBossMods/DBM-MoP,Deadly Boss Mods (DBM) - MoP mods,2021-11-02T17:39:21+00:00,mainline,85688,0mNwz4Go,23199
DBM-PvP,DeadlyBossMods/DBM-PvP,https://github.com/DeadlyBossMods/DBM-PvP,This mod adds support for PvP battlegrounds and arena to Deadly Boss Mods.,2021-11-20T06:04:26+00:00,"bcc,classic,mainline",61882,Xb6Xe0Kp,
DBM-RaidLeadTools,DeadlyBossMods/DBM-RaidLeadTools,https://github.com/DeadlyBossMods/DBM-RaidLeadTools,Raid Leader tools für DBM,2021-06-29T17:16:41+00:00,mainline,21364,,
DBM-Retail,DeadlyBossMods/DBM-Retail,https://github.com/DeadlyBossMods/DBM-Retail,"The ultimate encounter helper (for Retail) to give you fight info that's easy to process at a glance. DBM aims to focus on what's happening to you, and what YOU need to do about it.",2021-12-15T03:22:05+00:00,mainline,3358,qv633o6b,8814
DBM-SMGEventsPack,DeadlyBossMods/DBM-SMGEventsPack,https://github.com/DeadlyBossMods/DBM-SMGEventsPack,Several media files for DBM encounter Event feature.,2021-11-02T17:38:02+00:00,"bcc,classic,mainline",289632,Rn6VeENd,
DBM-SoundEventsPack,DeadlyBossMods/DBM-SoundEventsPack,https://github.com/DeadlyBossMods/DBM-SoundEventsPack,Several media files for DBM encounter Event feature.,2021-11-02T17:37:40+00:00,"bcc,classic,mainline",289311,qv63WD6b,
DBM-SpellTimers,DeadlyBossMods/DBM-SpellTimers,https://github.com/DeadlyBossMods/DBM-SpellTimers,Addon that uses DBM timers to show spell cooldowns from raid members. It is fully configurable through a simple GUI so you can easily add new spells.,2021-11-02T17:38:35+00:00,"bcc,classic,mainline",18712,,
DBM-WoD,DeadlyBossMods/DBM-WoD,https://github.com/DeadlyBossMods/DBM-WoD,Deadly Boss Mods (DBM) - WoD mods,2021-11-02T17:39:46+00:00,mainline,101956,LvNAkBKo,24535
DBM-WotLK,DeadlyBossMods/DBM-WotLK,https://github.com/DeadlyBossMods/DBM-WotLK,Deadly Boss Mods (DBM) - WotLK mods,2021-11-02T17:39:32+00:00,mainline,43970,WqKQg7Nx,21522
Instance-Achievement-Tracker,Dragnogd/Instance-Achievement-Tracker,https://github.com/Dragnogd/Instance-Achievement-Tracker,Track the completion and failure of achievements in raids and dungeons,2021-11-02T21:26:14+00:00,mainline,286675,RBKpXaKE,24756
Sku,Duugu/Sku,https://github.com/Duugu/Sku,,2021-12-19T23:04:17+00:00,bcc,,,
SkuAudioData,Duugu/SkuAudioData,https://github.com/Duugu/SkuAudioData,,2021-12-09T20:17:50+00:00,bcc,,,
SkuBeaconSoundsets,Duugu/SkuBeaconSoundsets,https://github.com/Duugu/SkuBeaconSoundsets,,2021-11-19T00:50:28+00:00,bcc,,,
SkuFluegel,Duugu/SkuFluegel,https://github.com/Duugu/SkuFluegel,,2021-12-05T17:30:49+00:00,bcc,,,
AutoLooter,Eliote/AutoLooter,https://github.com/Eliote/AutoLooter,WoW Addon to manage loot,2021-07-03T02:18:01+00:00,"bcc,mainline",94767,,
BrokerAnything,Eliote/BrokerAnything,https://github.com/Eliote/BrokerAnything,Addon for World of Warcraft to create a data broker for any ID,2021-07-03T18:02:04+00:00,"bcc,mainline",332601,,
TitanReputation,Eliote/TitanReputation,https://github.com/Eliote/TitanReputation,Titan Panel plugin that shows your Reputations,2021-07-03T19:01:01+00:00,"bcc,mainline",95571,,
ShestakUI_Classic,EsreverWoW/ShestakUI_Classic,https://github.com/EsreverWoW/ShestakUI_Classic,ShestakUI for WoW Classic (1.14.0) and Burning Crusade Classic (2.5.2),2021-11-08T18:30:38+00:00,"bcc,classic",468754,,25934
StoredAnimaCounter,Falx/StoredAnimaCounter,https://github.com/Falx/StoredAnimaCounter,Wow Addon that counts stored anima in your bags,2021-08-01T19:51:58+00:00,mainline,428797,,25837
StoredResearchCounter,Falx/StoredResearchCounter,https://github.com/Falx/StoredResearchCounter,,2021-08-01T21:48:32+00:00,mainline,508565,,26119
GuildSlacker,Glought/GuildSlacker,https://github.com/Glought/GuildSlacker,WoW addon on curseforge,2021-11-16T21:53:34+00:00,"classic,mainline",28027,,
AzeriteUI,GoldpawsStuff/AzeriteUI,https://github.com/GoldpawsStuff/AzeriteUI,Custom user interface suite for WoW. Design and code by Lars Norberg and Daniel Troconis.,2021-12-23T11:01:51+00:00,"bcc,classic,mainline",298648,R4N2PZKL,
Bagnon_BoE,GoldpawsStuff/Bagnon_BoE,https://github.com/GoldpawsStuff/Bagnon_BoE,Bagnon plugin showing BoE/BoU texts on your items. ,2021-12-12T21:30:10+00:00,"bcc,classic,mainline",277041,q96de4KO,
Bagnon_Garbage,GoldpawsStuff/Bagnon_Garbage,https://github.com/GoldpawsStuff/Bagnon_Garbage,Bagnon plugin desaturating and toning down garbage in your bags. ,2021-12-12T21:33:16+00:00,"bcc,classic,mainline",276936,2jK8YbGy,
Bagnon_ItemInfo,GoldpawsStuff/Bagnon_ItemInfo,https://github.com/GoldpawsStuff/Bagnon_ItemInfo,"Adds item levels, bind status, and garbage desaturation to bagnon all in one, with less overhead than using multiple addons.",2021-12-13T16:14:53+00:00,"bcc,classic,mainline",316029,pkNMBO6z,
Bagnon_ItemLevel,GoldpawsStuff/Bagnon_ItemLevel,https://github.com/GoldpawsStuff/Bagnon_ItemLevel,Bagnon plugin showing item levels on your items. ,2021-12-12T21:40:13+00:00,"bcc,classic,mainline",274607,J96Eg8Gg,
Bagnon_Uncollected,GoldpawsStuff/Bagnon_Uncollected,https://github.com/GoldpawsStuff/Bagnon_Uncollected,Bagnon plugin showing a purple eye on items which appearance you haven't learned yet. ,2021-12-12T21:41:38+00:00,mainline,316133,yQKyx567,
BigGameMenu,GoldpawsStuff/BigGameMenu,https://github.com/GoldpawsStuff/BigGameMenu,"A bigger game menu, with nicer graphics. ",2021-11-17T10:11:35+00:00,"bcc,classic,mainline",521057,qv63DkKb,
BigInputBox,GoldpawsStuff/BigInputBox,https://github.com/GoldpawsStuff/BigInputBox,A really big chat input box. Because why not.,2021-11-17T10:12:10+00:00,"bcc,classic,mainline",471001,XrNk0l6a,
ChatCleaner,GoldpawsStuff/ChatCleaner,https://github.com/GoldpawsStuff/ChatCleaner,"Makes system chat messages prettier and tidier, and reduces the need for multiple chat windows.",2021-12-15T21:17:51+00:00,"bcc,classic,mainline",531109,baNDwAGo,
ClassicWorldMapEnhanced,GoldpawsStuff/ClassicWorldMapEnhanced,https://github.com/GoldpawsStuff/ClassicWorldMapEnhanced,Enhanced WorldMap for WoW Classic,2021-11-17T10:14:00+00:00,"bcc,classic",340120,vEGPZk61,
MapShrinker,GoldpawsStuff/MapShrinker,https://github.com/GoldpawsStuff/MapShrinker,"A small addon that centers, shrinks, adds coordinates and nicely style the fullscreen retail WorldMap.",2021-11-03T11:52:35+00:00,mainline,469972,Rn6VOWKd,
PorousStoneDestroyer,GoldpawsStuff/PorousStoneDestroyer,https://github.com/GoldpawsStuff/PorousStoneDestroyer,It destroys porous stones. ,2021-12-12T09:34:30+00:00,mainline,551522,RXKqDl6y,
SharedMedia_Goldpaw,GoldpawsStuff/SharedMedia_Goldpaw,https://github.com/GoldpawsStuff/SharedMedia_Goldpaw,Various textures and media used in addons by Goldpaw and Blakmane!,2021-11-17T10:15:06+00:00,"bcc,classic,mainline",93875,R4N2lmKL,
SimpleClassPower,GoldpawsStuff/SimpleClassPower,https://github.com/GoldpawsStuff/SimpleClassPower,Class resource addon for World of Warcraft Retail.,2021-11-17T10:16:51+00:00,"bcc,classic,mainline",296245,qv63j7Nb,
Unmasked,GoldpawsStuff/Unmasked,https://github.com/GoldpawsStuff/Unmasked,We hate masks.,2021-11-24T19:03:01+00:00,mainline,544432,WL6JZO6v,
AshToAsh_BlizzardSkin,GreenhairTurtle/AshToAsh_BlizzardSkin,https://github.com/GreenhairTurtle/AshToAsh_BlizzardSkin,,2021-12-10T17:05:59+00:00,"bcc,classic,mainline",522904,Xb6XqBKp,
ImprovedAddonList,GreenhairTurtle/ImprovedAddonList,https://github.com/GreenhairTurtle/ImprovedAddonList,,2021-11-04T12:30:00+00:00,"bcc,classic,mainline",515814,baNDLJNo,
AngrierWorldQuests,GurliGebis/AngrierWorldQuests,https://github.com/GurliGebis/AngrierWorldQuests,,2021-07-01T07:13:21+00:00,mainline,,,
Aurora,Haleth/Aurora,https://github.com/Haleth/Aurora,Minimalistic UI theme for World of Warcraft,2021-06-03T15:37:30+00:00,"bcc,classic,mainline",278735,,18589
hekili,Hekili/hekili,https://github.com/Hekili/hekili,Hekili Priority Helper for DPS and Tanks (WoW Retail),2021-12-14T04:45:34+00:00,mainline,69254,WYK9WXNL,24608
AtlasLootClassic,Hoizame/AtlasLootClassic,https://github.com/Hoizame/AtlasLootClassic,AtlasLootClassic,2021-11-10T15:37:30+00:00,"bcc,classic",326516,RXKqzoGy,
wow-carrot-addon,IainCole/wow-carrot-addon,https://github.com/IainCole/wow-carrot-addon,A bunch of memes in a WoW addon,2021-11-18T03:46:23+00:00,mainline,547526,0mNw2PGo,26176
SurroundFix,Jademalo/SurroundFix,https://github.com/Jademalo/SurroundFix,A World of Warcraft UI AddOn to fix various UI issues with multiple monitor setups,2021-05-21T06:03:42+00:00,"bcc,classic,mainline",300214,e56nBm69,25251
MacFrames,JannesP/MacFrames,https://github.com/JannesP/MacFrames,,2021-11-05T15:03:51+00:00,mainline,412950,,25739
BlizzMove,Kiatra/BlizzMove,https://github.com/Kiatra/BlizzMove,World of Warcraft add-on to make the default windows movable via drag & drop.,2021-12-13T22:50:25+00:00,"bcc,classic,mainline",17809,,23875
ChocolateBar,Kiatra/ChocolateBar,https://github.com/Kiatra/ChocolateBar,ChocolateBar is a World of Warcraft addons to display plugins in a bar on top or bottom of your screen,2021-10-01T22:42:20+00:00,"bcc,classic,mainline",17424,,12326
AnnoyingPopupRemover,KyrosKrane/AnnoyingPopupRemover,https://github.com/KyrosKrane/AnnoyingPopupRemover,World of Warcraft addon to remove some annoying popups in the game,2021-11-29T08:53:26+00:00,"bcc,classic,mainline",93154,,23631
Details_ExplosiveOrbs,LiangYuxuan/Details_ExplosiveOrbs,https://github.com/LiangYuxuan/Details_ExplosiveOrbs,A simple Details! plugin which provides a custom display that shows how many explosive orbs players target and hit.,2021-11-08T09:56:59+00:00,mainline,352367,ZQ6aXANW,25932
FreeInstanceFetcher,LiangYuxuan/FreeInstanceFetcher,https://github.com/LiangYuxuan/FreeInstanceFetcher,User client to Free Instance Sharer.,2021-11-08T09:51:59+00:00,mainline,415572,VBNBMzGx,25930
FreeInstanceSharer,LiangYuxuan/FreeInstanceSharer,https://github.com/LiangYuxuan/FreeInstanceSharer,A light World of Warcraft addon to share your saved instance to others.,2021-09-26T07:23:27+00:00,mainline,319097,WL6JeYNv,25931
InvasionTimer,LiangYuxuan/InvasionTimer,https://github.com/LiangYuxuan/InvasionTimer,World of Warcraft addon that provides a datatext showing current and following invasions.,2021-06-29T07:50:54+00:00,mainline,311898,q96dAXKO,25933
HealBarsClassic,LiuCJonathan/HealBarsClassic,https://github.com/LiuCJonathan/HealBarsClassic,Healbars for Blizzard frames,2021-06-01T00:56:34+00:00,bcc,,,
speedy,LobsterBandit/speedy,https://github.com/LobsterBandit/speedy,Track character leveling in real and in-game time,2021-07-20T01:15:00+00:00,bcc,504267,,
AuctionBuddy,MarcLF/AuctionBuddy,https://github.com/MarcLF/AuctionBuddy,Auction house addon for World of Warcraft,2021-11-27T11:51:54+00:00,classic,336627,,
LibFrameFade,Meorawr/LibFrameFade,https://github.com/Meorawr/LibFrameFade,World of Warcraft library that attempts to fix UIFrameFade taint.,2021-09-14T20:15:27+00:00,"bcc,classic,mainline",523855,e56nRD69,26143
ElvUI_MerathilisUI,Merathilis/ElvUI_MerathilisUI,https://github.com/Merathilis/ElvUI_MerathilisUI,MerathilisUI is an external ElvUI Mod. It adds some usefull and probably not some usefull (lol) additions to ElvUI.,2021-12-04T14:17:01+00:00,"bcc,classic,mainline",97589,VBNBZVNx,24117
