name,description,url,last_updated,flavors
premade-applicants-filter,Allows filtering of premade applicants using advanced filter expressions.,https://github.com/0xbs/premade-applicants-filter,2021-07-19T21:11:20+00:00,mainline
premade-groups-filter,A World of Warcraft addon for powerful filtering of premade group listings,https://github.com/0xbs/premade-groups-filter,2021-07-19T20:59:17+00:00,mainline
premade-regions,Provides region information in the premade groups and applicants listings as well as to other addons.,https://github.com/0xbs/premade-regions,2021-07-09T18:02:33+00:00,mainline
HandyNotes_MoleMachine,Display locations of Dark Iron Dwarf mole machines.,https://github.com/AcidWeb/HandyNotes_MoleMachine,2021-11-03T06:23:36+00:00,mainline
PMWishList,,https://github.com/AcidWeb/PMWishList,2021-11-04T09:11:32+00:00,mainline
RECrystallize,Provide Auction House scanner and add item prices to tooltips.,https://github.com/AcidWeb/RECrystallize,2021-11-03T06:36:44+00:00,mainline
REFlex,Collect statistics of played arena matches and battlegrounds.,https://github.com/AcidWeb/REFlex,2021-11-04T09:14:22+00:00,mainline
REHack,Notebook/coding framework.,https://github.com/AcidWeb/REHack,2021-11-03T06:34:11+00:00,mainline
REKeys,Collect information about keystones owned by your friends.,https://github.com/AcidWeb/REKeys,2021-11-04T09:12:47+00:00,mainline
REPorter,Provide proper battleground map.,https://github.com/AcidWeb/REPorter,2021-11-03T06:38:01+00:00,mainline
RETabBinder,Handle automatic change of targeting keybind,https://github.com/AcidWeb/RETabBinder,2021-11-03T06:32:26+00:00,mainline
AdiButtonAuras,WoW addon - Display auras on action buttons.,https://github.com/AdiAddons/AdiButtonAuras,2021-09-12T09:46:09+00:00,mainline
AltReps,AltReps is an addon that allows you to track reputations across your characters,https://github.com/Alastair-Scott/AltReps,2021-07-01T18:21:23+00:00,mainline
ArenaLeaveConfirmer,,https://github.com/AlexFolland/ArenaLeaveConfirmer,2021-07-04T22:12:06+00:00,"bcc,classic,mainline"
AutoGear,WoW convenience addon that automatically handles gear looting and equipping,https://github.com/AlexFolland/AutoGear,2021-08-31T23:25:55+00:00,"bcc,classic,mainline"
BattlegroundSpiritReleaser,,https://github.com/AlexFolland/BattlegroundSpiritReleaser,2021-07-04T21:55:31+00:00,"bcc,classic,mainline"
CooldownReadyFlashDisabler,,https://github.com/AlexFolland/CooldownReadyFlashDisabler,2021-07-04T22:17:15+00:00,"bcc,classic,mainline"
DeleteConfirmer,Dangerous WoW addon that instantly confirms any item deletion,https://github.com/AlexFolland/DeleteConfirmer,2021-07-05T05:06:56+00:00,"bcc,classic,mainline"
DeleteGoodItemConfirmHelper,,https://github.com/AlexFolland/DeleteGoodItemConfirmHelper,2021-07-04T21:48:28+00:00,"bcc,classic,mainline"
DirectGameMenu,,https://github.com/AlexFolland/DirectGameMenu,2021-07-05T04:49:09+00:00,"bcc,classic,mainline"
GarbageProtector,,https://github.com/AlexFolland/GarbageProtector,2021-07-04T22:03:31+00:00,"bcc,classic,mainline"
PrintTracer,World Of Warcraft addon for tracing the source of print calls,https://github.com/AlexFolland/PrintTracer,2021-07-05T05:19:11+00:00,"bcc,classic,mainline"
CovenantFeatureRewards,Shows which rewards you can get from your covenant feature,https://github.com/ArekosAddons/CovenantFeatureRewards,2021-10-01T18:23:21+00:00,mainline
LunarlightPodHelper,Helps finding unlit Lunarlight Pods,https://github.com/ArekosAddons/LunarlightPodHelper,2021-10-01T18:32:47+00:00,mainline
Auctionator,The Auctionator addon for World of Warcraft.,https://github.com/Auctionator/Auctionator,2021-11-11T18:27:38+00:00,"bcc,classic,mainline"
Collectionator,"World of Warcraft addon for the Auction House that adds a new Collecting tab to browse uncollected transmogs, pets, toys, mounts and recipes on all your alts.",https://github.com/Auctionator/Collectionator,2021-11-03T06:28:19+00:00,mainline
Journalator,World of Warcraft addon. Keep track of your gold making on the AH and with vendors,https://github.com/Auctionator/Journalator,2021-11-03T06:27:40+00:00,mainline
AddOnSkins,,https://github.com/Azilroka/AddOnSkins,2021-10-17T04:07:00+00:00,"bcc,classic,mainline"
ProjectAzilroka,,https://github.com/Azilroka/ProjectAzilroka,2021-05-23T00:24:04+00:00,mainline
ThreatPlates,Nameplate addon for World of Warcraft,https://github.com/Backupiseasy/ThreatPlates,2021-11-14T13:00:57+00:00,"bcc,classic,mainline"
BattlePetQualityCheck,"Check if the quality of wild pets in a battle is better than pets of the same species in your journal. When the addon detects a pet with better quality, it displays a message in the default chat frame. The same happens when it detects a non-collected pet.",https://github.com/Beast-Masters-addons/BattlePetQualityCheck,2021-08-20T20:33:52+00:00,mainline
HuntersHelper,Show where to learn pet spells,https://github.com/Beast-Masters-addons/HuntersHelper,2021-06-18T19:19:13+00:00,classic
pet-battle-teams,,https://github.com/Beast-Masters-addons/pet-battle-teams,2021-08-21T17:08:08+00:00,mainline
BigWigs,"Modular, lightweight, non-intrusive approach to boss encounter warnings.",https://github.com/BigWigsMods/BigWigs,2021-11-02T22:10:00+00:00,mainline
BigWigs_BattleForAzeroth,A collection of BigWigs modules from the Battle for Azeroth era.,https://github.com/BigWigsMods/BigWigs_BattleForAzeroth,2021-06-29T21:40:11+00:00,mainline
BigWigs_BurningCrusade,A collection of BigWigs modules from the Burning Crusade era.,https://github.com/BigWigsMods/BigWigs_BurningCrusade,2021-09-16T23:47:50+00:00,mainline
BigWigs_Cataclysm,A collection of BigWigs modules from the Cataclysm era.,https://github.com/BigWigsMods/BigWigs_Cataclysm,2021-06-29T21:40:18+00:00,mainline
BigWigs_Classic,A collection of BigWigs modules from the Classic era.,https://github.com/BigWigsMods/BigWigs_Classic,2021-06-29T21:40:18+00:00,mainline
BigWigs_CommonAuras,Displays messages and bars for common raid cooldowns.,https://github.com/BigWigsMods/BigWigs_CommonAuras,2021-06-30T05:34:51+00:00,mainline
BigWigs_Countdown_HeroesOfTheStorm,Adds countdown voices from Heroes of the Storm to BigWigs.,https://github.com/BigWigsMods/BigWigs_Countdown_HeroesOfTheStorm,2021-06-30T15:34:09+00:00,"bcc,classic,mainline"
BigWigs_Countdown_Overwatch,Adds countdown voices from the heroes in Overwatch to BigWigs.,https://github.com/BigWigsMods/BigWigs_Countdown_Overwatch,2021-06-30T15:34:33+00:00,"bcc,classic,mainline"
BigWigs_Legion,A collection of BigWigs modules from the Legion era.,https://github.com/BigWigsMods/BigWigs_Legion,2021-06-29T21:40:27+00:00,mainline
BigWigs_MistsOfPandaria,A collection of BigWigs modules from the Mists of Pandaria era.,https://github.com/BigWigsMods/BigWigs_MistsOfPandaria,2021-06-29T21:40:34+00:00,mainline
BigWigs_Transcriptor,Simple addon that uses BigWigs for pull/win/wipe detection and starts or stops Transcriptor logging accordingly.,https://github.com/BigWigsMods/BigWigs_Transcriptor,2021-06-30T05:18:52+00:00,"bcc,mainline"
BigWigs_Voice,A plugin for BigWigs that will play Text-To-Speech sounds for boss abilities.,https://github.com/BigWigsMods/BigWigs_Voice,2021-07-15T14:37:18+00:00,mainline
BigWigs_WarlordsOfDraenor,A collection of BigWigs modules from the Warlords of Draenor era.,https://github.com/BigWigsMods/BigWigs_WarlordsOfDraenor,2021-06-29T21:40:39+00:00,mainline
BigWigs_WrathOfTheLichKing,A collection of BigWigs modules from the Wrath of the Lich King era.,https://github.com/BigWigsMods/BigWigs_WrathOfTheLichKing,2021-06-29T21:40:50+00:00,mainline
Capping,Battleground timers and other PvP features.,https://github.com/BigWigsMods/Capping,2021-06-29T21:44:08+00:00,mainline
LittleWigs,Boss warnings for 5-man dungeons & scenarios.,https://github.com/BigWigsMods/LittleWigs,2021-11-03T19:35:11+00:00,mainline
Transcriptor,Logging utility for boss encounters.,https://github.com/BigWigsMods/Transcriptor,2021-07-13T11:45:56+00:00,mainline
oRA3,Raid and Party Assist.,https://github.com/BigWigsMods/oRA3,2021-06-29T21:47:46+00:00,mainline
BattleGroundEnemies,A enemy display for battlegrounds,https://github.com/BullseiWoWAddons/BattleGroundEnemies,2021-06-28T14:55:31+00:00,"bcc,mainline"
HealthNumbers,https://www.curseforge.com/wow/addons/healthnumbers,https://github.com/BullseiWoWAddons/HealthNumbers,2021-06-08T21:25:18+00:00,bcc
LibChangelog,,https://github.com/BullseiWoWAddons/LibChangelog,2021-06-28T14:51:31+00:00,"bcc,mainline"
CraftPresence-Wow-Edition,Port of https://gitlab.com/CDAGaming/CraftPresence for World of Warcraft (Mirrored to Github from Gitlab),https://github.com/CDAGaming/CraftPresence-Wow-Edition,2021-09-01T13:08:18+00:00,"bcc,classic,mainline"
TargetNameplateIndicator,A WoW AddOn that puts a texture on your target's nameplate to make them stand out.,https://github.com/Choonster-WoW-AddOns/TargetNameplateIndicator,2021-10-03T07:03:10+00:00,mainline
LFMPlus,"LFM+ (Looking for Mythic Plus) enhances the default LFG UI for Mythic+ activies to make looking for, or creating, a group for keys in World of Warcraft.",https://github.com/ChrisKader/LFMPlus,2021-11-15T04:19:07+00:00,mainline
NPCScan,"NPCScan with rares in the Shadowlands zones, Darkshore, Nazjatar, Mechagon, N'Zoth assaults in Uldum/Vale of Eternal Blossoms.",https://github.com/CruelDrool/NPCScan,2021-11-07T22:40:12+00:00,mainline
AllTheThings,ALL THE THINGS - Addon for Tracking Collections & Account Completion in World of Warcraft,https://github.com/DFortun81/AllTheThings,2021-11-14T18:01:55+00:00,mainline
DBM-Archaeology,Brings the old gods right to your dig site to give archaeology a more epic feel.,https://github.com/DeadlyBossMods/DBM-Archaeology,2021-11-02T17:41:10+00:00,mainline
DBM-BCVanilla,Deadly Boss Mods (DBM) - BC & Vanilla mods (Retail),https://github.com/DeadlyBossMods/DBM-BCVanilla,2021-11-02T17:39:04+00:00,mainline
DBM-BfA,Deadly Boss Mods (DBM) - Battle for Azeroth mods,https://github.com/DeadlyBossMods/DBM-BfA,2021-11-02T17:38:48+00:00,mainline
DBM-Cataclysm,Deadly Boss Mods (DBM) - Cataclysm mods,https://github.com/DeadlyBossMods/DBM-Cataclysm,2021-11-02T17:41:29+00:00,mainline
DBM-Challenges,"This mod will add support for player challenges such as Proving Grounds, Broken Shore Mage Tower, BfA Horrific Visions, and Torghast scenarios to Deadly Boss Mods (DBM).",https://github.com/DeadlyBossMods/DBM-Challenges,2021-11-02T17:36:36+00:00,mainline
DBM-CountPack-HotS,A collection of Heroes of the Storm countdown sound options for use with Deadly Boss Mods.,https://github.com/DeadlyBossMods/DBM-CountPack-HotS,2021-11-02T17:41:50+00:00,"bcc,classic,mainline"
DBM-CountPack-Overwatch,A collection of Overwatch countdown sound options for use with Deadly Boss Mods.,https://github.com/DeadlyBossMods/DBM-CountPack-Overwatch,2021-11-02T17:42:04+00:00,"bcc,classic,mainline"
DBM-Dungeons,"Adds support for 5 man Dungeons to Retail WoW, spanning Vanilla all the way to Legion, to Deadly Boss Mods.",https://github.com/DeadlyBossMods/DBM-Dungeons,2021-11-02T17:36:16+00:00,mainline
DBM-Legion,Deadly Boss Mods (DBM) - Legion mods,https://github.com/DeadlyBossMods/DBM-Legion,2021-11-02T17:40:35+00:00,mainline
DBM-MoP,Deadly Boss Mods (DBM) - MoP mods,https://github.com/DeadlyBossMods/DBM-MoP,2021-11-02T17:39:21+00:00,mainline
DBM-PvP,This mod adds support for PvP battlegrounds and arena to Deadly Boss Mods.,https://github.com/DeadlyBossMods/DBM-PvP,2021-11-02T17:38:21+00:00,"bcc,classic,mainline"
DBM-RaidLeadTools,Raid Leader tools für DBM,https://github.com/DeadlyBossMods/DBM-RaidLeadTools,2021-06-29T17:16:41+00:00,mainline
DBM-SMGEventsPack,Several media files for DBM encounter Event feature.,https://github.com/DeadlyBossMods/DBM-SMGEventsPack,2021-11-02T17:38:02+00:00,"bcc,classic,mainline"
DBM-SoundEventsPack,Several media files for DBM encounter Event feature.,https://github.com/DeadlyBossMods/DBM-SoundEventsPack,2021-11-02T17:37:40+00:00,"bcc,classic,mainline"
DBM-SpellTimers,Addon that uses DBM timers to show spell cooldowns from raid members. It is fully configurable through a simple GUI so you can easily add new spells.,https://github.com/DeadlyBossMods/DBM-SpellTimers,2021-11-02T17:38:35+00:00,"bcc,classic,mainline"
DBM-WoD,Deadly Boss Mods (DBM) - WoD mods,https://github.com/DeadlyBossMods/DBM-WoD,2021-11-02T17:39:46+00:00,mainline
DBM-WotLK,Deadly Boss Mods (DBM) - WotLK mods,https://github.com/DeadlyBossMods/DBM-WotLK,2021-11-02T17:39:32+00:00,mainline
Instance-Achievement-Tracker,Track the completion and failure of achievements in raids and dungeons,https://github.com/Dragnogd/Instance-Achievement-Tracker,2021-11-02T21:26:14+00:00,mainline
Sku,,https://github.com/Duugu/Sku,2021-11-15T07:17:28+00:00,bcc
SkuAudioData,,https://github.com/Duugu/SkuAudioData,2021-11-13T05:06:03+00:00,bcc
SkuBeaconSoundsets,,https://github.com/Duugu/SkuBeaconSoundsets,2021-11-13T05:12:23+00:00,bcc
SkuFluegel,,https://github.com/Duugu/SkuFluegel,2021-11-13T05:08:40+00:00,bcc
AutoLooter,WoW Addon to manage loot,https://github.com/Eliote/AutoLooter,2021-07-03T02:18:01+00:00,"bcc,mainline"
BrokerAnything,Addon for World of Warcraft to create a data broker for any ID,https://github.com/Eliote/BrokerAnything,2021-07-03T18:02:04+00:00,"bcc,mainline"
TitanReputation,Titan Panel plugin that shows your Reputations,https://github.com/Eliote/TitanReputation,2021-07-03T19:01:01+00:00,"bcc,mainline"
ShestakUI_Classic,ShestakUI for WoW Classic (1.14.0) and Burning Crusade Classic (2.5.2),https://github.com/EsreverWoW/ShestakUI_Classic,2021-11-08T18:30:38+00:00,"bcc,classic"
StoredAnimaCounter,Wow Addon that counts stored anima in your bags,https://github.com/Falx/StoredAnimaCounter,2021-08-01T19:51:58+00:00,mainline
StoredResearchCounter,,https://github.com/Falx/StoredResearchCounter,2021-08-01T21:48:32+00:00,mainline
AzeriteUI,Custom user interface suite for WoW. Design and code by Lars Norberg and Daniel Troconis.,https://github.com/GoldpawsStuff/AzeriteUI,2021-11-03T10:43:28+00:00,"bcc,classic,mainline"
Bagnon_BoE,Bagnon plugin showing BoE/BoU texts on your items. ,https://github.com/GoldpawsStuff/Bagnon_BoE,2021-11-03T12:01:23+00:00,"bcc,classic,mainline"
Bagnon_Garbage,Bagnon plugin desaturating and toning down garbage in your bags. ,https://github.com/GoldpawsStuff/Bagnon_Garbage,2021-11-03T12:00:10+00:00,"bcc,classic,mainline"
Bagnon_ItemInfo,"Adds item levels, bind status, and garbage desaturation to bagnon all in one, with less overhead than using multiple addons.",https://github.com/GoldpawsStuff/Bagnon_ItemInfo,2021-11-03T11:56:41+00:00,mainline
Bagnon_ItemLevel,Bagnon plugin showing item levels on your items. ,https://github.com/GoldpawsStuff/Bagnon_ItemLevel,2021-11-03T12:02:25+00:00,"bcc,classic,mainline"
BigGameMenu,"A bigger game menu, with nicer graphics. ",https://github.com/GoldpawsStuff/BigGameMenu,2021-11-03T11:58:58+00:00,"bcc,classic,mainline"
BigInputBox,A really big chat input box. Because why not.,https://github.com/GoldpawsStuff/BigInputBox,2021-11-05T12:20:11+00:00,"bcc,classic,mainline"
ChatCleaner,,https://github.com/GoldpawsStuff/ChatCleaner,2021-11-03T11:54:33+00:00,"bcc,classic,mainline"
ClassicWorldMapEnhanced,Enhanced WorldMap for WoW Classic,https://github.com/GoldpawsStuff/ClassicWorldMapEnhanced,2021-10-18T11:40:55+00:00,"bcc,classic"
MapShrinker,"A small addon that centers, shrinks, adds coordinates and nicely style the fullscreen retail WorldMap.",https://github.com/GoldpawsStuff/MapShrinker,2021-11-03T11:52:35+00:00,mainline
SharedMedia_Goldpaw,Various textures and media used in addons by Goldpaw and Blakmane!,https://github.com/GoldpawsStuff/SharedMedia_Goldpaw,2021-11-03T11:51:21+00:00,"bcc,classic,mainline"
SimpleClassPower,Class resource addon for World of Warcraft Retail.,https://github.com/GoldpawsStuff/SimpleClassPower,2021-11-03T11:50:20+00:00,"bcc,classic,mainline"
Unmasked,We hate masks.,https://github.com/GoldpawsStuff/Unmasked,2021-11-13T12:40:59+00:00,mainline
AshToAsh_BlizzardSkin,,https://github.com/GreenhairTurtle/AshToAsh_BlizzardSkin,2021-10-19T15:23:36+00:00,"bcc,classic,mainline"
ImprovedAddonList,,https://github.com/GreenhairTurtle/ImprovedAddonList,2021-11-04T12:30:00+00:00,"bcc,classic,mainline"
AngrierWorldQuests,,https://github.com/GurliGebis/AngrierWorldQuests,2021-07-01T07:13:21+00:00,mainline
Aurora,Minimalistic UI theme for World of Warcraft,https://github.com/Haleth/Aurora,2021-06-03T15:37:30+00:00,"bcc,classic,mainline"
hekili,Hekili Priority Helper for DPS and Tanks (WoW Retail),https://github.com/Hekili/hekili,2021-11-15T14:55:17+00:00,mainline
AtlasLootClassic,AtlasLootClassic,https://github.com/Hoizame/AtlasLootClassic,2021-11-10T15:37:30+00:00,"bcc,classic"
SurroundFix,A World of Warcraft UI AddOn to fix various UI issues with multiple monitor setups,https://github.com/Jademalo/SurroundFix,2021-05-21T06:03:42+00:00,"bcc,classic,mainline"
MacFrames,,https://github.com/JannesP/MacFrames,2021-11-05T15:03:51+00:00,mainline
BlizzMove,World of Warcraft add-on to make the default windows movable via drag & drop.,https://github.com/Kiatra/BlizzMove,2021-11-14T11:24:57+00:00,"bcc,classic,mainline"
ChocolateBar,ChocolateBar is a World of Warcraft addons to display plugins in a bar on top or bottom of your screen,https://github.com/Kiatra/ChocolateBar,2021-10-01T22:42:20+00:00,"bcc,classic,mainline"
AnnoyingPopupRemover,World of Warcraft addon to remove some annoying popups in the game,https://github.com/KyrosKrane/AnnoyingPopupRemover,2021-11-03T02:51:13+00:00,"bcc,classic,mainline"
Details_ExplosiveOrbs,A simple Details! plugin which provides a custom display that shows how many explosive orbs players target and hit.,https://github.com/LiangYuxuan/Details_ExplosiveOrbs,2021-11-08T09:56:59+00:00,mainline
FreeInstanceFetcher,User client to Free Instance Sharer.,https://github.com/LiangYuxuan/FreeInstanceFetcher,2021-11-08T09:51:59+00:00,mainline
FreeInstanceSharer,A light World of Warcraft addon to share your saved instance to others.,https://github.com/LiangYuxuan/FreeInstanceSharer,2021-09-26T07:23:27+00:00,mainline
InvasionTimer,World of Warcraft addon that provides a datatext showing current and following invasions.,https://github.com/LiangYuxuan/InvasionTimer,2021-06-29T07:50:54+00:00,mainline
HealBarsClassic,Healbars for Blizzard frames,https://github.com/LiuCJonathan/HealBarsClassic,2021-06-01T00:56:34+00:00,bcc
speedy,Track character leveling in real and in-game time,https://github.com/LobsterBandit/speedy,2021-07-20T01:15:00+00:00,bcc
AuctionBuddy,Auction house addon for World of Warcraft,https://github.com/MarcLF/AuctionBuddy,2021-11-14T21:45:26+00:00,bcc
LibFrameFade,World of Warcraft library that attempts to fix UIFrameFade taint.,https://github.com/Meorawr/LibFrameFade,2021-09-14T20:15:27+00:00,"bcc,classic,mainline"
ElvUI_MerathilisUI,MerathilisUI is an external ElvUI Mod. It adds some usefull and probably not some usefull (lol) additions to ElvUI.,https://github.com/Merathilis/ElvUI_MerathilisUI,2021-11-15T08:21:23+00:00,"bcc,classic,mainline"
TrackEverything, World of Warcraft Classic addon that helps you to handle tracking abilities.,https://github.com/MickeyPickey/TrackEverything,2021-07-05T11:47:13+00:00,bcc
MrBigglesworthDeath,,https://github.com/Myrroddin/MrBigglesworthDeath,2021-11-02T23:42:18+00:00,"bcc,classic,mainline"
adibags-archaeology,,https://github.com/Myrroddin/adibags-archaeology,2021-11-02T23:50:13+00:00,mainline
adibags-hearthstones,,https://github.com/Myrroddin/adibags-hearthstones,2021-11-02T23:53:15+00:00,mainline
elvui_progressive_databars_colours,,https://github.com/Myrroddin/elvui_progressive_databars_colours,2021-11-02T23:54:59+00:00,"bcc,classic,mainline"
feedtillers,,https://github.com/Myrroddin/feedtillers,2021-11-02T23:36:38+00:00,mainline
hideminimapbutton,,https://github.com/Myrroddin/hideminimapbutton,2021-11-02T23:40:09+00:00,"bcc,classic,mainline"
libaboutpanel-2.0,,https://github.com/Myrroddin/libaboutpanel-2.0,2021-11-02T23:44:13+00:00,"bcc,classic,mainline"
repbyzone,,https://github.com/Myrroddin/repbyzone,2021-11-10T07:02:09+00:00,"bcc,classic,mainline"
sharedmedia-classicalfonts,,https://github.com/Myrroddin/sharedmedia-classicalfonts,2021-11-02T23:46:00+00:00,"bcc,classic,mainline"
tradeskillmaster-string-converter,,https://github.com/Myrroddin/tradeskillmaster-string-converter,2021-11-02T23:48:04+00:00,"bcc,classic,mainline"
AdiBags_Shadowlands_Bait,,https://github.com/N6REJ/AdiBags_Shadowlands_Bait,2021-11-05T02:52:34+00:00,mainline
AdiBags_Shadowlands_Blacksmithing,,https://github.com/N6REJ/AdiBags_Shadowlands_Blacksmithing,2021-11-12T03:36:34+00:00,mainline
AdiBags_Shadowlands_Cooking,Shadowlands 9.1 cooking,https://github.com/N6REJ/AdiBags_Shadowlands_Cooking,2021-11-12T11:50:35+00:00,mainline
AdiBags_Shadowlands_Engineering,,https://github.com/N6REJ/AdiBags_Shadowlands_Engineering,2021-11-15T00:36:35+00:00,mainline
AdiBags_Shadowlands_Herbs,,https://github.com/N6REJ/AdiBags_Shadowlands_Herbs,2021-11-12T03:49:27+00:00,mainline
AdiBags_Shadowlands_Inscription,,https://github.com/N6REJ/AdiBags_Shadowlands_Inscription,2021-11-12T02:28:23+00:00,mainline
AdiBags_Shadowlands_Leatherworking,sorts Leatherworking reagents into their own categories,https://github.com/N6REJ/AdiBags_Shadowlands_Leatherworking,2021-11-12T12:31:41+00:00,mainline
AdiBags_Shadowlands_Meat,"AdiBags Shadowlands Meat is a filter package for AdiBags addon that adds an automatic ""Meat"" category for the Shadowlands expansion.",https://github.com/N6REJ/AdiBags_Shadowlands_Meat,2021-11-06T20:45:56+00:00,mainline
AdiBags_Shadowlands_Mining,,https://github.com/N6REJ/AdiBags_Shadowlands_Mining,2021-11-12T04:07:20+00:00,mainline
AdiBags_Shadowlands_Skinning,,https://github.com/N6REJ/AdiBags_Shadowlands_Skinning,2021-11-11T00:31:42+00:00,mainline
AdiBags_Shadowlands_Tailoring,,https://github.com/N6REJ/AdiBags_Shadowlands_Tailoring,2021-11-12T04:20:19+00:00,mainline
Adibags_Shadowlands_Alchemy,,https://github.com/N6REJ/Adibags_Shadowlands_Alchemy,2021-11-12T10:27:09+00:00,mainline
Adibags_Shadowlands_Enchanting,sorts Enchanting reagents into their own category.,https://github.com/N6REJ/Adibags_Shadowlands_Enchanting,2021-11-12T04:01:46+00:00,mainline
Adibags_Shadowlands_Fishing,Opensource extension to World Of Warcraft for professions,https://github.com/N6REJ/Adibags_Shadowlands_Fishing,2021-11-07T16:29:23+00:00,mainline
Adibags_Shadowlands_Jewelcrafting,Sorts jewels for shadowlands,https://github.com/N6REJ/Adibags_Shadowlands_Jewelcrafting,2021-11-12T04:08:23+00:00,mainline
MapPinEnhanced,,https://github.com/Nercus/MapPinEnhanced,2021-08-24T15:35:51+00:00,mainline
Bartender4,ActionBar AddOn for World of Warcraft,https://github.com/Nevcairiel/Bartender4,2021-06-29T09:37:04+00:00,"bcc,classic,mainline"
GatherMate2,"GatherMate2 is an addon to collect and track herbs, mines, fishing pools, gas clouds, archaelogy finds and treasures for World of Warcraft",https://github.com/Nevcairiel/GatherMate2,2021-06-29T21:34:18+00:00,mainline
GatherMate2_Data,,https://github.com/Nevcairiel/GatherMate2_Data,2021-07-02T06:18:29+00:00,mainline
HandyNotes,Handy Notes for your maps. ,https://github.com/Nevcairiel/HandyNotes,2021-06-29T21:29:57+00:00,"bcc,classic,mainline"
HereBeDragons,,https://github.com/Nevcairiel/HereBeDragons,2021-05-08T12:29:42+00:00,mainline
Inventorian,Inventorian is a simple bag addon for World of Warcraft that combines all individual bags into one huge inventory for easier management.,https://github.com/Nevcairiel/Inventorian,2021-06-29T04:55:49+00:00,mainline
Mapster,Mapster is a very simple world map enhacement addon for World of Warcraft,https://github.com/Nevcairiel/Mapster,2021-06-29T21:25:07+00:00,"bcc,classic,mainline"
Quartz,Quartz is a modular approach to a casting bar addon for World of Warcraft,https://github.com/Nevcairiel/Quartz,2021-09-21T07:22:55+00:00,"bcc,mainline"
Quester,"Quester is an addon for World of Warcraft, which aims to improve the questing experience with small enhancements",https://github.com/Nevcairiel/Quester,2021-06-29T21:26:56+00:00,mainline
Routes,Routes WoW Addon,https://github.com/Nevcairiel/Routes,2021-06-29T21:31:02+00:00,"bcc,classic,mainline"
wowhead-quick-link,World of Warcraft Addon that allows you to quickly look up anything on Wowhead without having to manually search for it.,https://github.com/NielsHeltner/wowhead-quick-link,2021-07-10T16:00:49+00:00,"bcc,classic,mainline"
NoobTacoUI,"An ElvUI Profile based off of Nord Theme. Dark, but not to dark.",https://github.com/NoobTaco/NoobTacoUI,2021-05-24T16:36:57+00:00,"bcc,classic,mainline"
AuctionHouseConfirmQuantity,Forces user to confirm quantity when buying more than 1 item from the AH,https://github.com/Numynum/AuctionHouseConfirmQuantity,2021-11-03T10:03:20+00:00,mainline
AzeriteTraitTooltips,WoW addon,https://github.com/Numynum/AzeriteTraitTooltips,2021-11-03T10:09:06+00:00,mainline
BlizzMovePlugin_QuestTracker,BlizzMove Plugin to make the QuestTracker movable,https://github.com/Numynum/BlizzMovePlugin_QuestTracker,2021-11-03T18:09:44+00:00,"bcc,classic,mainline"
BlizzMovePlugin_VenturePlan,,https://github.com/Numynum/BlizzMovePlugin_VenturePlan,2021-11-03T18:09:54+00:00,mainline
GKickCommand,,https://github.com/Numynum/GKickCommand,2021-11-03T10:04:03+00:00,"bcc,classic,mainline"
HandyNotes_FerryNetwork,WoW addon,https://github.com/Numynum/HandyNotes_FerryNetwork,2021-11-03T10:04:12+00:00,mainline
InviteOnWhisper,WoW addon,https://github.com/Numynum/InviteOnWhisper,2021-11-03T10:05:04+00:00,"bcc,classic,mainline"
LazyCurve,LazyCurve WoW addon,https://github.com/Numynum/LazyCurve,2021-11-03T10:09:34+00:00,mainline
MythicPlusPullReEstimated,,https://github.com/Numynum/MythicPlusPullReEstimated,2021-11-03T10:05:19+00:00,mainline
RecipeLinkFix,WoW addon,https://github.com/Numynum/RecipeLinkFix,2021-11-03T10:05:28+00:00,mainline
